{
  "type": "provisioning",
  "device_id": "9Xf1Gh2Jk3Lm4No5Pq6Rs7Tu8Vw9XyAbCdEfGhJkLmNoPqRs",
  "manifest_ref": "7b3GQk6nM1dH8sZLs9KxV2wqE4pR5aBcDeFgHiJkLmNoPqRsT",
  "nonce": "a1b2c3d4e5f60789",
  "timestamp": "2026-07-25T12:30:00Z",
  "payload": {
    "firmware_version": "1.0.1",
    "state": "booting",
    "metrics": {
      "temp_c": 36.5,
      "voltage_v": 229.4
    },
    "context": {
      "provisioning_session_id": "sess-123456",
      "policy_version": "0.1.0"
    }
  },
  "signature": "MEUCIQDvW1q3m6W0uQZLQ2+8fJq1nYH2tVt4+4g5c3pQ2T9H9wIgf5A9Kx7Vn4N2+WZ5q1H8t3G6iJ1hK8v2R6pYQ==",
  "signature_algorithm": "ed25519"
}
